id,subject,slug,url,source,title,description
65,Eliminazione del precariato,eliminazione-del-precariato,https://it.wikipedia.org/wiki/Precariato,Wikipedia,Precariato,"Con il termine precariato si intende l'insieme dei soggetti lavoratori che vivono una generale condizione lavorativa di incertezza che si protrae, involontariamente, per molto tempo."
66,Aumento dell'assegno sociale per gli invalidi,aumento-dellassegno-sociale-per-gli-invalidi,https://it.wikipedia.org/wiki/Assegno_ordinario_di_invalidit%C3%A0,Wikipedia,Assegno ordinario di invalidità,"L'assegno ordinario di invalidità è una prestazione economica erogata dalla Repubblica Italiana, erogabile a domanda, ai lavoratori dipendenti assicurati presso l'INPS e affetti da infermità o difetto fisico o mentale che abbiano ridotto in modo permanente la loro capacità di lavoro, in attività confacenti le proprie attitudini, in misura superiore ai due terzi."
67,Alternanza scuola-lavoro,alternanza-scuolalavoro,https://it.wikipedia.org/wiki/PCTO_-_Percorsi_per_le_Competenze_Trasversali_e_per_l%27Orientamento,Wikipedia,"PCTO - Percorsi per le Competenze Trasversali e per l'Orientamento - 
Wikipedia","I PCTO (Percorsi per le Competenze Trasversali e per l'Orientamento) sono progetti di carattere curricolare, che permettono agli studenti di integrare la tradizionale formazione d'aula con periodi formativi presso imprese o enti privati o pubblici convenzionati, ma anche nei laboratori della scuola o in ambienti di simulazione. Per quanto riguarda le attività esterne, le norme prevedono la tutela della salute e sicurezza ed escludono esplicitamente che tali attività si possano configurare come lavoro."
68,Obbligo scolastico fino a 18 anni,obbligo-scolastico-fino-a-18-anni,https://it.wikipedia.org/wiki/Obbligo_formativo_in_Italia,Wikipedia,Obbligo formativo in Italia,
69,Didattica a distanza,didattica-a-distanza,https://it.wikipedia.org/wiki/Didattica_a_distanza,Wikipedia,Didattica a distanza,"La didattica a distanza (anche indicata con gli acronimi DAD, Dad o DaD) è una forma di didattica che avviene senza la presenza degli insegnanti e degli studenti in aula, avvalendosi di strumenti elettronici o online. L'espressione si contrappone a didattica in presenza, che è invece caratterizzata dalla presenza fisica degli studenti e degli insegnanti in aula."
70,Autonomia differenziata,autonomia-differenziata,https://temi.camera.it/leg18/temi/tl18_lautonomia_differenziata_delle_regioni_a_statuto_ordinario.html,Camera dei deputati,L'autonomia differenziata delle regioni a statuto ordinario,
71,Sostegno psicologico scolastico,sostegno-psicologico-scolastico,https://it.wikipedia.org/wiki/Psicologia_scolastica,Wikipedia,Psicologia scolastica,"Gli psicologi scolastici sono addestrati a svolgere test psicologici, valutazione e consulenza psicoeducativa, e nei codici etici, legali e amministrativi della loro professione. La psicologia scolastica affronta una varietà di temi e di problematiche, come ad esempio i disturbi specifici di apprendimento, l'esclusione sociale, la violenza, il bullismo e la multiculturalità."
72,Investimenti per la formazione dei docenti,investimenti-per-la-formazione-dei-docenti,https://it.wikipedia.org/wiki/Docente_in_Italia,Wikipedia,Docente in Italia,
73,Investimenti per le politiche sportive,investimenti-per-le-politiche-sportive,https://www.miur.gov.it/politiche-sportive-scolastiche,Ministero dell'Istruzione,Politiche Sportive Scolastiche,
74,Sostegno ai disabili nelle scuole,sostegno-ai-disabili-nelle-scuole,https://it.wikipedia.org/wiki/Integrazione_scolastica,Wikipedia,Integrazione scolastica,"L'integrazione scolastica si ottiene attraverso l'affiancamento, nell'ambiente scolastico, di un operatore qualificato alla persona con disabilità e la programmazione di un'attività scolastica specifica tale da permetterle l'apprendimento e soprattutto la relazione nell'ambiente scolastico e sociale."
75,Sostegno per gli universitari fuorisede,sostegno-per-gli-universitari-fuorisede,,,,
76,Aiutare i giovani laureati a rimanere in Italia,aiutare-i-giovani-laureati-a-rimanere-in-italia,https://it.wikipedia.org/wiki/Fuga_di_cervelli,Wikipedia,Fuga di cervelli,"Molti giovani neolaureati interessati ad utilizzare e sviluppare le proprie capacità lasciano l'Italia poiché non riescono a trovarvi posizioni adatte alle loro capacità, ben remunerate e soprattutto con migliori prospettive di fare carriera.Questo fenomeno è conosciuto anche con l'espressione di: fuga dei cervelli"
77,Mense scolastiche gratuite,mense-scolastiche-gratuite,https://it.wikipedia.org/wiki/Mensa_(pubblico_esercizio),Wikipedia,Mensa (pubblico esercizio),
78,Favorire la creazione delle comunità energetiche,favorire-la-creazione-delle-comunit-energetiche,https://it.wikipedia.org/wiki/Comunit%C3%A0_di_energia_rinnovabile,Wikipedia,Comunità di energia rinnovabile,"Una comunità di energia rinnovabile, anche detta comunità energetica rinnovabile o semplicemente comunità energetica, è un gruppo di soggetti che si organizzano per produrre e condividere localmente l'energia prodotta da fonti rinnovabili."
79,Libri di testo gratuiti,libri-di-testo-gratuiti,https://it.wikipedia.org/wiki/Libro_di_testo,Wikipedia,Libro di testo,
80,Più meritocrazia a scuola e nei concorsi,pi-meritocrazia-a-scuola-e-nei-concorsi,https://it.wikipedia.org/wiki/Meritocrazia,Wikipedia,Meritocrazia,"Indica una forma di governo in cui le cariche pubbliche, amministrative, e qualsiasi ruolo o professione che richieda responsabilità nei confronti di altri, è affidata secondo criteri di merito, e non di appartenenza a lobby, o altri tipi di conoscenze familiari (nepotismo e in senso allargato clientelismo) o di casta economica (oligarchia)."
81,Promozione degli Istituti tecnici superiori,promozione-degli-istituti-tecnici-superiori,https://www.miur.gov.it/tematica-its,Ministero dell'Istruzione,Istituti tecnici superiori (ITS),
82,Promozione della parità di genere,promozione-della-parit-di-genere,https://it.wikipedia.org/wiki/Uguaglianza_di_genere,Wikipedia,Uguaglianza di genere,"L'uguaglianza di genere, conosciuta anche come parità tra i sessi, parità di genere, uguaglianza sessuale o uguaglianza dei generi, è una condizione nella quale le persone ricevono pari trattamenti, con uguale facilità di accesso a risorse e opportunità, indipendentemente dal genere, a meno che non ci sia una valida ragione biologica per un trattamento diverso."
83,Promozione della sicurezza sul lavoro,promozione-della-sicurezza-sul-lavoro,https://www.interno.gov.it/it/temi/prevenzione-e-soccorso/sicurezza-sul-lavoro,Ministero dell'Interno,Sicurezza sul lavoro,
84,Integrazione tra università e aziende,integrazione-tra-universit-e-aziende,,,,
85,Scuola infanzia gratuita,scuola-infanzia-gratuita,https://it.wikipedia.org/wiki/Scuola_dell%27infanzia,Wikipedia,Scuola dell'infanzia,La scuola dell'infanzia (nota anche e in passato unicamente come scuola materna) consiste in Italia nel percorso pre-scolastico rivolto ai bambini dai tre ai sei anni d'età.
86,Trasporto scolastico gratuito,trasporto-scolastico-gratuito,https://it.wikipedia.org/wiki/Scuolabus,Wikipedia,Scuolabus,Lo scuolabus è un veicolo destinato al trasporto degli studenti delle scuole primarie sia di primo sia di secondo grado. Negli Stati Uniti d'America lo scuolabus può trasportare qualsiasi tipo di studente scolastico o studente di scuola in tutte  le tipologie di scuola americana.
87,Sostegno ai meno abbienti e incapienti,sostegno-ai-meno-abbienti-e-incapienti,,,,
88,Sviluppo dei servizi sanitari di prossimità,sviluppo-dei-servizi-sanitari-di-prossimit,https://it.wikipedia.org/wiki/Azienda_sanitaria_locale,Wikipedia,Azienda sanitaria locale,"Un'azienda sanitaria locale (abbreviato ASL) o azienda unità sanitaria locale (AUSL) è un ente pubblico della pubblica amministrazione italiana, deputato all'erogazione di servizi sanitari in un determinato territorio, di solito provinciale. In singole regioni assume diverse denominazioni (ASP, ASM, ATS)."
89,Tutela dell'ambiente e del paesaggio,tutela-dellambiente-e-del-paesaggio,,,,
90,Favorire il riscatto della laurea,favorire-il-riscatto-della-laurea,https://www.inps.it/prestazioni-servizi/riscatto-della-laurea-ai-fini-pensionistici-gestioni-dipendenti-privati,INPS,Riscatto della laurea ai fini pensionistici gestioni dipendenti privati,"Il riscatto del corso di laurea è un istituto che permette di valorizzare ai fini pensionistici il periodo del proprio corso di studi.

Il riscatto di laurea è valido a condizione che l’interessato abbia conseguito il titolo di studio."
91,Sostegno alla scuola paritaria,sostegno-alla-scuola-paritaria,https://www.miur.gov.it/sapere-la-differenza-tra-le-scuole-paritarie-e-le-scuole-private,Ministero dell'Istruzione,Sapere la differenza tra le scuole paritarie e le scuole private,
92,Scuola dell'infanzia obbligatoria,scuola-dellinfanzia-obbligatoria,https://it.wikipedia.org/wiki/Scuola_dell%27infanzia,Wikipedia,Scuola dell'infanzia,La scuola dell'infanzia (nota anche e in passato unicamente come scuola materna) consiste in Italia nel percorso pre-scolastico rivolto ai bambini dai tre ai sei anni d'età.
93,Più attività extrascolastiche,pi-attivit-extrascolastiche,,,,
94,Abolizione del numero chiuso all'università,abolizione-del-numero-chiuso-alluniversit,https://it.wikipedia.org/wiki/Universit%C3%A0_in_Italia#Accesso_ai_corsi,Wikipedia,Università in Italia,"Le università in Italia sono enti che hanno il compito di promuovere la ricerca, il progresso delle scienze e l'istruzione di livello superiore. Possono essere enti pubblici o di diritto privato: nel primo caso fanno parte della pubblica amministrazione italiana. Alcuni corsi di studio prevedono l'accesso ad un numero prestabilito di studenti (come nel caso delle facoltà di medicina e altre)."
95,Tutela del benessere animale,tutela-del-benessere-animale,https://it.wikipedia.org/wiki/Diritti_degli_animali,Wikipedia,Diritti degli animali,"L'espressione diritti animali (o diritti degli animali) si riferisce all'estensione alle specie animali di alcuni dei diritti fondamentali dell'uomo, quali il diritto di vivere in libertà o di non soffrire inutilmente. Il termine ""diritto"" viene inteso in senso morale e legale."
96,Commissione di inchiesta sulla Covid-19,commissione-di-inchiesta-sulla-covid19,https://it.wikipedia.org/wiki/Commissione_parlamentare_d%27inchiesta#Fondamento_normativo_nella_Costituzione_italiana,Wikipedia,Commissione parlamentare d'inchiesta,"Le commissioni parlamentari d'inchiesta sono degli organi parlamentari investite della funzione ispettiva, conoscitiva o anche di indagine, su materie di interesse pubblico.Una commissione d'inchiesta viene istituita per mezzo di una legge dedicata (se bicamerale) o da semplice risoluzione della camera interessata (se monocamerale), solitamente in casi gravi per effettuare indagini da affiancare (e non sostituire) a quelle della magistratura."
97,Lotta alla corruzione,lotta-alla-corruzione,https://it.wikipedia.org/wiki/Corruzione,Wikipedia,Corruzione,"La corruzione indica la condotta di un soggetto che induce qualcuno, in cambio di denaro oppure di altre utilità e/o vantaggi, ad agire contro i propri doveri e obblighi."
98,Aumento delle spese militari,aumento-delle-spese-militari,https://it.wikipedia.org/wiki/Spesa_per_la_difesa_in_Italia,Wikipedia,Spesa per la difesa in Italia,"La spesa per la difesa in Italia indica la spesa per la difesa per le forze armate italiane. Il DPR 15 novembre 2012, n. 236, regolamenta la definizione del prezzo e delle condizioni di acquisto per appalti e forniture, ad affidamento diretto o con gara d'appalto pubblicata nella Gazzetta Ufficiale della Repubblica Italiana, con le procedure della NATO. Il criterio generale è quello dell'offerta al prezzo più basso (art. 33-34), salvo valutazione di congruità."
99,Leva militare obbligatoria,leva-militare-obbligatoria,https://it.wikipedia.org/wiki/Servizio_militare_di_leva_in_Italia,Wikipedia,Servizio militare di leva in Italia,"Il servizio militare di leva indica, in Italia, il servizio militare obbligatorio. Istituito nello stato unitario italiano con la nascita del Regno d'Italia e confermato con la nascita della Repubblica italiana, è stato in regime operativo dal 1861 al 2004. L'obbligatorietà del servizio, prevista dalla costituzione della Repubblica Italiana, è ordinariamente inattiva dal 1º gennaio 2005, come stabilito dalla legge 23 agosto 2004, n. 226."
100,Condoni fiscali o edilizi,condoni-fiscali-o-edilizi,https://it.wikipedia.org/wiki/Condono,Wikipedia,Condono,"Il condono è un provvedimento emanato dal legislatore o dal governo, tramite il quale i cittadini che vi aderiscono possono ottenere l'annullamento, totale o parziale, di una pena o di una sanzione. Il condono fiscale (o ""condono tributario"") è un dispositivo normativo che ha come oggetto principale le imposte e le tasse, soprattutto dichiarazioni dei redditi errate, infedeli o assenti. Il condono edilizio, invece, previa autodenuncia, sana fenomeni di abusivismo nell'ambito delle regole di costruzione, di ampliamento o di modifica di natura edile."
101,Sostegno alle imprese turistiche,sostegno-alle-imprese-turistiche,,,,
102,Riforma del sistema penitenziario,riforma-del-sistema-penitenziario,https://it.wikipedia.org/wiki/Ordinamento_penitenziario_italiano,Wikipedia,Ordinamento penitenziario italiano,L'ordinamento penitenziario italiano è l'insieme delle norme che regolamentano gli istituti di reclusione e la loro organizzazione.
103,Ripristino dei decreti Sicurezza,ripristino-dei-decreti-sicurezza,,,,
104,Riforma del sistema di accoglienza,riforma-del-sistema-di-accoglienza,https://it.wikipedia.org/wiki/Centri_per_l%27immigrazione_in_Italia,Wikipedia,Centri per l'immigrazione in Italia,"I centri per l'immigrazione in Italia offrono accoglienza ai cittadini stranieri arrivati nel paese irregolarmente in vista della loro identificazione ed eventuale richiesta di asilo o espulsione.
I centri, gestiti dalla Direzione centrale dei servizi civili per l'immigrazione e dell'asilo del Ministero dell'Interno, sono di quattro tipologie: Centri di Primo Soccorso e Accoglienza (CPSA), Centri di Accoglienza (CDA), Centri di Accoglienza per Richiedenti Asilo (CARA), Centri di Identificazione ed Espulsione (CIE)."
105,Blocco navale,blocco-navale,https://it.wikipedia.org/wiki/Blocco_navale,Wikipedia,Blocco navale,"Il blocco navale è un'azione militare finalizzata a impedire l'accesso e l'uscita di navi dai porti di un Paese o di un territorio. Dopo la creazione delle Nazioni Unite è stato disciplinato dal diritto internazionale, in particolare dall'articolo 42 dello statuto delle Nazioni Unite e non è consentito al di fuori dei casi di legittima difesa ovvero consentito solo in caso di stato di guerra tra due o più Stati."
106,Contrasto alle baby gang,contrasto-alle-baby-gang,https://it.wikipedia.org/wiki/Baby_gang,Wikipedia,Baby gang,"Con baby gang o banda giovanile si intende un fenomeno di micro criminalità organizzata, generalmente diffuso nei contesti urbani, per il quale minorenni assumono comportamenti devianti ai danni di cose o persone."
107,Investimenti in cybersicurezza,investimenti-in-cybersicurezza,https://it.wikipedia.org/wiki/Sicurezza_informatica,Wikipedia,Sicurezza informatica,"La sicurezza informatica (in inglese computer security) è l'insieme dei mezzi, delle tecnologie e delle procedure tesi alla 
protezione dei sistemi informatici in termini di disponibilità, confidenzialità e integrità dei beni o asset informatici. La sicurezza informatica è un problema molto sentito in ambito tecnico-informatico per via della crescente informatizzazione della società e dei servizi (pubblici e privati) in termini di apparati e sistemi informatici e della parallela diffusione e specializzazione degli attaccanti."
108,Maggiore inclusione per gli immigrati regolari,maggiore-inclusione-per-gli-immigrati-regolari,"https://it.wikipedia.org/wiki/Inclusione_sociale#Inclusione,_integrazione,_normalizzazione",Wikipedia,Inclusione sociale,Il termine inclusione sociale si riferisce alla società e alle sue attività inclusive. Abbraccia numerosi aspetti e ambiti tra i quali l'inclusione scolastica e l'inclusione lavorativa. Il fine ultimo dell'inclusione sociale è garantire l'inserimento di ciascun individuo all'interno della società indipendentemente dalla presenza di elementi limitanti.
109,Creazione di hot-spot fuori dall'Ue,creazione-di-hotspot-fuori-dallue,https://it.wikipedia.org/wiki/Convenzioni_sui_profughi#Il_metodo_%E2%80%9Chotspot%E2%80%9D[4],Wikipedia,Convenzioni sui profughi,"Il termine hotspot indica le “zone di crisi”, ossia quelle aree situate esternamente alle frontiere dell’UE che sono interessate da uno sproporzionato flusso migratorio. In questi punti, i funzionari nazionali sono affiancati da “squadre di sostegno per la gestione della migrazione”, a loro volta composte da personale proveniente da varie Agenzie dell’UE."
110,"Abolizione della legge ""Bossi-Fini""",abolizione-della-legge-bossifini,https://it.wikipedia.org/wiki/Legge_Bossi-Fini,Wikipedia,Legge Bossi-Fini,"La legge 30 luglio 2002, n. 189, meglio nota come legge Bossi-Fini, è una normativa della Repubblica Italiana che disciplina l'immigrazione. Le principali novità della legge furono: espulsioni con accompagnamento alla frontiera, permesso di soggiorno legato ad un lavoro effettivo, inasprimento delle pene per i trafficanti di esseri umani, sanatoria per colf, assistenti ad anziani, malati e diversamente abili, lavoratori con contratto di lavoro di almeno 1 anno, uso delle navi della Marina Militare per contrastare il traffico di clandestini."
111,Allargamento dei corridoi umanitari,allargamento-dei-corridoi-umanitari,https://www.esteri.it/it/politica-estera-e-cooperazione-allo-sviluppo/temi_globali/diritti_umani/i-corridoi-umanitari/,Ministero degli Affari Esteri,I corridoi umanitari,"I corridoi umanitari sono un progetto pilota di “patrocinio privato” nell’accoglienza e integrazione di migranti vulnerabili e rifugiati. L’esperienza dimostra come, utilizzando gli strumenti legislativi già a disposizione degli Stati membri dell’Unione europea, si possano garantire ingressi regolari scongiurando rischiosi “viaggi della speranza” a favore di persone in condizioni di particolare vulnerabilità e di effettivo bisogno di protezione internazionale."
112,Riforma dei trattati Ue sull'immigrazione,riforma-dei-trattati-ue-sullimmigrazione,https://it.wikipedia.org/wiki/Convenzione_di_Dublino,Wikipedia,Convenzione di Dublino,"La Convenzione di Dublino è un trattato internazionale multilaterale in tema di diritto di asilo. Il corrispondente regolamento di Dublino è un regolamento dell'Unione europea, che stabilisce ""i criteri e i meccanismi di determinazione dello Stato membro competente per l'esame di una domanda di protezione internazionale presentata in uno degli Stati membri da un cittadino di un paese terzo o da un apolide (rifusione)"", nell'ambito della Convenzione relativa allo status dei rifugiati del 1951 e la relativa direttiva UE."
113,Riforma del Patto di stabilità e crescita,riforma-del-patto-di-stabilit-e-crescita,https://it.wikipedia.org/wiki/Patto_di_stabilit%C3%A0_e_crescita,Wikipedia,Patto di stabilità e crescita,"Il patto di stabilità e crescita (PSC) è un accordo internazionale, stipulato e sottoscritto nel 1997 dagli Stati membri dell'Unione europea, inerente al controllo delle rispettive politiche di bilancio pubbliche, al fine di mantenere fermi i requisiti di adesione all'Unione economica e monetaria dell'Unione europea (Eurozona) ovvero rafforzare il percorso d'integrazione monetaria intrapreso nel 1992 con la sottoscrizione del trattato di Maastricht."
114,Accordi di cooperazione con Paesi d'origine,accordi-di-cooperazione-con-paesi-dorigine,,,,
115,Elezione diretta del presidente del Consiglio,elezione-diretta-del-presidente-del-consiglio,https://it.wikipedia.org/wiki/Premierato,Wikipedia,Premierato,Col termine premierato si indicano nel linguaggio politico varianti della forma di governo parlamentare dai contorni non sempre ben definiti.  In generale le due caratteristiche che vengono attribuite (solo talvolta congiuntamente) al premierato sono - l'indicazione del capo di governo da parte dell'elettorato (se non l'elezione diretta) e/o - un ruolo rafforzato dello stesso capo di governo rispetto al parlamento. In Italia la carica non è elettiva ma viene assegnata dal Presidente della Repubblica ai sensi dell'articolo 92 della Costituzione.
116,Riforma della legge elettorale,riforma-della-legge-elettorale,https://it.wikipedia.org/wiki/Sistema_elettorale_in_Italia,Wikipedia,Sistema elettorale in Italia,"Il sistema elettorale italiano è l'insieme delle regole con cui, sulla base dei voti espressi dai cittadini italiani durante le elezioni, sono assegnati i seggi all'interno degli organi politico-istituzionali locali, nazionali ed europei."
117,Digitalizzazione della giustizia,digitalizzazione-della-giustizia,,,,
118,Minore durata dei processi,minore-durata-dei-processi,https://it.wikipedia.org/wiki/Processo_(diritto),Wikipedia,Processo (diritto),"Il processo (talvolta indicato come giudizio), in diritto, è il procedimento attraverso il quale viene esercitata la funzione giurisdizionale e si conclude con una sentenza."
119,Maggiore ricorso alla depenalizzazione,maggiore-ricorso-alla-depenalizzazione,https://it.wikipedia.org/wiki/Depenalizzazione,Wikipedia,Depenalizzazione,"La depenalizzazione, nel gergo giuridico italiano, consiste nel trasformare illeciti penali in illeciti amministrativi."
120,Riforma delle professioni penitenziarie,riforma-delle-professioni-penitenziarie,,,,
121,Investimenti nell'edilizia per la giustizia,investimenti-nelledilizia-per-la-giustizia,,,,
122,Separazione delle carriere dei Magistrati,separazione-delle-carriere-dei-magistrati,,,,
123,Riforma della giustizia civile e penale,riforma-della-giustizia-civile-e-penale,,,,
124,Riforma della giustizia tributaria,riforma-della-giustizia-tributaria,https://it.wikipedia.org/wiki/Giustizia_tributaria,Wikipedia,Giustizia tributaria,"Con il termine giustizia tributaria si fa riferimento, nel diritto tributario, all'insieme di mezzi che l'ordinamento giuridico predispone a tutela delle situazioni giuridiche dei soggetti nei confronti delle pubbliche amministrazioni impositrici di prestazioni tributarie."
125,"Modifica della legge ""Severino""",modifica-della-legge-severino,https://it.wikipedia.org/wiki/Legge_Severino,Wikipedia,Legge Severino,"La legge 6 novembre 2012, n. 190 (nota anche come legge Severino dal nome del Ministro della giustizia del governo Monti, Paola Severino) è una legge della Repubblica Italiana in tema di prevenzione e repressione della corruzione."
126,Riforma della custodia cautelare,riforma-della-custodia-cautelare,https://it.wikipedia.org/wiki/Custodia_cautelare_in_carcere,Wikipedia,Custodia cautelare in carcere,"La custodia cautelare in carcere è una misura cautelare personale, coercitiva e custodiale, prevista e disciplinata dall'art. 285 codice di procedura penale. Col provvedimento che dispone la custodia, il giudice ordina agli ufficiali e agli agenti di polizia giudiziaria che l'indagato o imputato sia catturato e immediatamente condotto in un istituto di custodia per rimanervi a disposizione dell'autorità giudiziaria."
127,Riduzione del sovraffolamento carcerario,riduzione-del-sovraffolamento-carcerario,https://en.wikipedia.org/wiki/Prison_overcrowding,Wikipedia,Prison overcrowding,
128,Eliminazione della prescrizione,eliminazione-della-prescrizione,https://it.wikipedia.org/wiki/Prescrizione_(ordinamento_civile_italiano),Wikipedia,Prescrizione (ordinamento civile italiano),"La prescrizione del reato è l'istituto che risponde a un principio di economia dei sistemi giudiziari in base al quale lo Stato rinuncia a perseguire l'autore di un reato, quando dalla sua commissione sia trascorso un periodo di tempo giudicato eccessivamente lungo e solitamente proporzionale alla gravità dello stesso."
129,Responsabilità civile dei magistrati,responsabilit-civile-dei-magistrati,https://it.wikipedia.org/wiki/Magistratura_italiana#La_responsabilit%C3%A0,Wikipedia,Magistratura italiana,"I magistrati rispondono penalmente, civilmente e disciplinarmente delle azioni da loro commesse a danno dei cittadini nell'esercizio delle loro funzioni. Il principio della responsabilità civile dei magistrati ha il suo fondamento nell'art. 28 della Costituzione, secondo cui i funzionari e i dipendenti dello Stato e degli enti pubblici sono direttamente responsabili, secondo le leggi penali, civili e amministrative, degli atti compiuti in violazione di diritti. In tali casi da essa si estende allo Stato e agli enti pubblici."
130,Riduzione cambi di gruppo in Parlamento,riduzione-cambi-di-gruppo-in-parlamento,https://it.wikipedia.org/wiki/Trasformismo_(politica),Wikipedia,Trasformismo (politica),
131,Maternità surrogata,maternit-surrogata,https://it.wikipedia.org/wiki/Surrogazione_di_maternit%C3%A0,Wikipedia,Surrogazione di maternità,"La surrogazione di maternità, maternità surrogata o gestazione per altri (spesso abbreviata in GPA) è una forma di procreazione assistita in cui una donna provvede alla gestazione per conto di una o più persone, che saranno il genitore o i genitori del nascituro."
