id,subject,slug,url,source,title,description
1,Tetto al prezzo del gas,tetto-al-prezzo-del-gas,https://it.wikipedia.org/wiki/Tariffe_del_gas,Wikipedia,Tariffe del gas,Le tariffe di distribuzione e misura del gas naturale sono fissate dall'Autorità per l'energia elettrica il gas e il sistema idrico (AEEGSI) e sono dirette a remunerare gli operatori della distribuzione del gas per i servizi resi all'utente finale in ragione dei contratti di  concessione locale di cui sono titolari.
2,Taglio del cuneo fiscale,taglio-del-cuneo-fiscale,https://it.wikipedia.org/wiki/Cuneo_fiscale,Wikipedia,Cuneo fiscale,"Il cuneo fiscale è un indicatore percentuale che indica il rapporto tra tutte le imposte sul lavoro (dirette, indirette e contributi previdenziali) e il costo del lavoro complessivo."
3,Taglio delle tasse per le partite IVA,taglio-delle-tasse-per-le-partite-iva,https://it.wikipedia.org/wiki/Partita_IVA#Lavoratori_a_partita_IVA,Wikipedia,Partita IVA,"I lavoratori autonomi e i liberi professionisti sono tenuti ad aprire una partita IVA. L'enorme espansione del numero degli interessati ha fatto nascere in Italia l'espressione ""il popolo delle partite IVA"". In questo contesto quando si dice ""è una partita IVA"" s'intende una persona che ha una partita IVA, che lavora a partita IVA."
4,Riduzione dell'IVA,riduzione-delliva,https://it.wikipedia.org/wiki/Imposta_sul_valore_aggiunto,Wikipedia,Imposta sul valore aggiunto,"L'imposta sul valore aggiunto, in acronimo IVA, è un'imposta – adottata nel 1968 da numerosi Paesi del mondo (tra i quali anche i membri dell'UE) – applicata sul valore aggiunto di ogni fase della produzione, di scambio di beni e servizi."
5,Flat tax,flat-tax,https://it.wikipedia.org/wiki/Flat_tax,Wikipedia,Flat tax,"In scienza delle finanze, la flat tax (letteralmente in italiano: tassa piatta, calcolata come percentuale costante) è un sistema fiscale non progressivo, basato su un'aliquota fissa, al netto di eventuali deduzioni fiscali o detrazioni."
6,Salario minimo,salario-minimo,https://it.wikipedia.org/wiki/Salario_minimo,Wikipedia,Salario minimo,"Il salario minimo, nel diritto del lavoro, è la più bassa remunerazione o paga oraria, giornaliera o mensile che in taluni Stati i datori di lavoro devono per legge corrispondere ai propri lavoratori dipendenti ovvero impiegati e operai."
7,Superbonus 110%,superbonus-110,https://it.wikipedia.org/wiki/Superbonus_110%25,Wikipedia,Superbonus 110%,"Il Superbonus 110% è una misura di incentivazione introdotta il 19 maggio 2020 dal governo Conte II. Consiste in una serie di meccanismi d'agevolazione, detrazioni e rimborsi per interventi di natura edilizia, con l'obiettivo di ammodernare 
costruzioni e infrastrutture, migliorandone l'efficienza energetica e al contempo di stimolare e risollevare il settore edile in crisi a causa della pandemia di COVID-19."
8,Aiuti militari all'Ucraina,aiuti-militari-allucraina,,,,
9,Adesione alla NATO,adesione-alla-nato,https://it.wikipedia.org/wiki/NATO,Wikipedia,NATO,"L'Organizzazione del Trattato dell'Atlantico del Nord (in inglese: North Atlantic Treaty Organization, in sigla NATO, in francese: Organisation du Traité de l'Atlantique Nord, in sigla OTAN) è un'organizzazione internazionale per la collaborazione nel settore della difesa."
10,Sanzioni contro la Russia,sanzioni-contro-la-russia,https://it.wikipedia.org/wiki/Sanzioni_internazionali_durante_la_crisi_russo-ucraina,Wikipedia,Sanzioni internazionali durante la crisi russo-ucraina,"Le sanzioni internazionali durante la crisi in Ucraina furono intraprese da numerosi Stati contro la Russia, a seguito dell'intervento militare russo in Ucraina cominciato alla fine di febbraio 2014. Le sanzioni furono imposte da Stati Uniti, Unione europea e altri Stati e organizzazioni internazionali contro singoli individui, tra cui imprenditori e funzionari russi e ucraini. La Russia ha risposto con sanzioni contro alcuni paesi, bandendo l'importazione di cibo da Unione europea, Stati Uniti, Norvegia, Canada e Australia."
11,Reddito di cittadinanza,reddito-di-cittadinanza,https://it.wikipedia.org/wiki/Reddito_di_cittadinanza_(Italia),Wikipedia,Reddito di cittadinanza (Italia),"Il sussidio, istituito con il Decreto Legge n°4 del 28 gennaio 2019 dalla Repubblica Italiana, è una forma condizionata e non individuale di reddito minimo garantito. Viene chiamato impropriamente reddito di cittadinanza nel DL stesso, pur essendo totalmente privo delle caratteristiche di tale reddito di base."
12,Aumento delle pensioni,aumento-delle-pensioni,https://it.wikipedia.org/wiki/Pensione,Wikipedia,Pensione,"La pensione è un' obbligazione che consiste in una rendita vitalizia o temporanea, corrisposta a una persona fisica in base a un rapporto giuridico con l'ente o la società che è obbligata a corrisponderla per la tutela del rischio di longevità o di altri rischi (invalidità, inabilità, superstiti, indiretta)."
13,Adesione all'UE,adesione-allue,https://it.wikipedia.org/wiki/Unione_europea,Wikipedia,Unione europea,"L'Unione europea, abbreviata in UE, è un'unione politica ed economica a carattere sovranazionale, che comprende 27 Stati membri."
14,Uscita dall'Euro,uscita-dalleuro,https://it.wikipedia.org/wiki/Euro,Wikipedia,Euro,L'euro è la valuta ufficiale dei paesi della zona euro e l'unica attualmente adottata da 19 dei 27 Stati membri dell'Unione aderenti all'Unione economica e monetaria dell'Unione europea.
15,Trivelle,trivelle,https://it.wikipedia.org/wiki/Trivellazione_in_mare_aperto,Wikipedia,Trivellazione in mare aperto,"La trivellazione in mare aperto è un processo meccanico in cui viene praticato un pozzo attraverso il fondale marino. Viene in genere effettuato per esplorare e successivamente estrarre petrolio o gas naturale che si trova in formazioni rocciose sotto il fondo del mare. Più comunemente, il termine è usato per descrivere le attività di perforazione sulla piattaforma continentale, sebbene il termine possa essere applicato anche alla perforazione in laghi, acque costiere e mari interni."
16,Nucleare,nucleare,https://it.wikipedia.org/wiki/Energia_nucleare,Wikipedia,Energia nucleare,"L'energia nucleare, o energia atomica, è l'energia liberata dalle reazioni nucleari. Questa energia è sfruttata da numerose tecnologie e ha una particolare rilevanza nel settore energetico, infatti comunemente ci si riferisce all'energia nucleare come a quella liberata in modo controllato nelle centrali nucleari per la produzione di energia elettrica."
17,Rigassificatori,rigassificatori,https://it.wikipedia.org/wiki/Rigassificatore,Wikipedia,Rigassificatore,"Un rigassificatore è un impianto che permette di riportare un fluido che normalmente in natura si presenta sotto forma di gas, dallo stato fisico-liquido a quello aeriforme. L'impianto non è da confondersi invece con il gassificatore, che ha tutt'altre funzioni. I più noti impianti di questo tipo sono i rigassificatori GNL, utilizzati nel ciclo di trasporto del gas naturale."
18,Presidenzialismo,presidenzialismo,https://it.wikipedia.org/wiki/Repubblica_presidenziale,Wikipedia,Repubblica presidenziale,"La repubblica presidenziale (o presidenzialismo) è una forma di governo in cui il potere esecutivo si concentra nella figura del Presidente che è sia il capo dello Stato sia il capo del governo. Generalmente viene democraticamente eletto direttamente dai cittadini e forma il suo governo ed essendo capo di Stato non ha bisogno di voto di fiducia parlamentare, avendo già ottenuto il voto della maggioranza dei cittadini."
19,Energie rinnovabili,energie-rinnovabili,https://it.wikipedia.org/wiki/Fonti_di_energia_rinnovabile,Wikipedia,Fonti di energia rinnovabile,"Le fonti di energia rinnovabile sono fonti energetiche non soggette ad esaurimento perché naturalmente reintegrate in una scala temporale umana tramite processi fisici - come avviene per la luce solare, il vento, il ciclo dell'acqua, le maree, le onde e il calore geotermico - o chimici, come avviene per la biomassa. Le energie rinnovabili trovano applicazione nella produzione di energia elettrica, nel riscaldamento e raffrescamento degli ambienti e nei servizi di trasporto."
20,Termovalorizzatori,termovalorizzatori,https://it.wikipedia.org/wiki/Termovalorizzatore,Wikipedia,Termovalorizzatore,"Il termovalorizzatore è un inceneritore che converte il calore generato dalla combustione dei rifiuti in energia destinata ad altro uso. Può svolgere la funzione di centrali elettriche, producendo energia elettrica tramite un impianto costituito da una turbina a vapore. Oltre alla produzione di energia elettrica, al termovalorizzatore può essere associato un impianto cogenerazione per il teleriscaldamento o un impianto di gassificazione per la produzione del gas di sintesi."
21,Investimenti in infrastrutture,investimenti-in-infrastrutture,https://www.treccani.it/enciclopedia/infrastrutture_%28Enciclopedia-delle-scienze-sociali%29,Treccani,Infrastrutture,"Il termine ""infrastrutture"" viene usato per designare quel complesso di beni capitali che, pur non utilizzati direttamente nel processo produttivo, forniscono una serie di servizi indispensabili per il funzionamento del sistema economico: strade, linee ferroviarie, porti, scuole, ospedali, ecc."
22,Investimenti per il Mezzogiorno,investimenti-per-il-mezzogiorno,https://it.wikipedia.org/wiki/Mezzogiorno_(Italia),Wikipedia,Mezzogiorno (Italia),Il Mezzogiorno o Meridione d'Italia è un'area geografica italiana comprendente l'Italia meridionale e quella insulare.
23,Investimenti per la ricerca,investimenti-per-la-ricerca,https://it.wikipedia.org/wiki/Ricerca_scientifica,Wikipedia,Ricerca scientifica,"La ricerca scientifica è un'attività condotta da scienziati, ricercatori o altri studiosi avente lo scopo di scoprire, interpretare e revisionare fatti, eventi, per poi trascriverli."
24,Revisione del PNRR,revisione-del-pnrr,https://it.wikipedia.org/wiki/Piano_Nazionale_di_Ripresa_e_Resilienza,Wikipedia,Piano Nazionale di Ripresa e Resilienza,"Il Piano Nazionale di Ripresa e Resilienza è il piano approvato nel 2021 dall'Italia per rilanciarne l'economia dopo la pandemia di COVID-19, al fine di permettere lo sviluppo verde e digitale del Paese."
25,Riduzione o eliminazione dell'IRAP,riduzione-o-eliminazione-dellirap,https://it.wikipedia.org/wiki/Imposta_regionale_sulle_attivit%C3%A0_produttive,Wikipedia,Imposta regionale sulle attività produttive,"L'imposta regionale sulle attività produttive, nota anche con l'acronimo IRAP, è un'imposta istituita in Italia con il decreto legislativo 15 dicembre 1997, n. 446 e attualmente in vigore."
26,Sostegno a piccole e medie imprese,sostegno-a-piccole-e-medie-imprese,https://it.wikipedia.org/wiki/Piccole_e_medie_imprese,Wikipedia,Piccole e medie imprese,"Le piccole e medie imprese o PMI sono aziende le cui dimensioni rientrano entro certi limiti occupazionali e finanziari prefissati. Per questa ragione, e anche per le oggettive difficoltà di attrarre capitali, Stati e Regioni di solito mettono in atto politiche di sostegno verso le PMI."
27,Riduzione delle bollette energetiche,riduzione-delle-bollette-energetiche,https://it.wikipedia.org/wiki/Bolletta,Wikipedia,Bolletta,Una bolletta è una fatturazione postale o elettronica di un contratto di fornitura di servizi.
28,Patrimoniale,patrimoniale,https://it.wikipedia.org/wiki/Imposta_patrimoniale,Wikipedia,Imposta patrimoniale,"L'imposta patrimoniale, talvolta anche indicata in ambito giornalistico come ""imposta o tassa sui 
ricchi"", è un'imposta sul patrimonio personale e generale delle persone fisiche."
29,Aumento dell'assegno unico universale,aumento-dellassegno-unico-universale,https://it.wikipedia.org/wiki/Assegni_familiari,Wikipedia,Assegni familiari,"Gli assegni familiari sono un contributo economico, concesso dallo Stato italiano, ai lavoratori per il coniuge e i figli dello stesso, a condizione che questi non prestino alcuna attività lavorativa retribuita."
30,Introduzione del conto unico fiscale,introduzione-del-conto-unico-fiscale,,,,
31,Lotta all'evasione fiscale,lotta-allevasione-fiscale,https://it.wikipedia.org/wiki/Evasione_fiscale,Wikipedia,Evasione fiscale,"La locuzione ""evasione fiscale"" indica tutti quei metodi volti a ridurre o eliminare il prelievo fiscale da parte di uno Stato sul cittadino o azienda contribuente attraverso la violazione di specifiche norme fiscali da parte di questi ultimi."
32,Agevolazioni ai giovani per i mutui,agevolazioni-ai-giovani-per-i-mutui,https://it.wikipedia.org/wiki/Mutuo#Mutui_per_la_casa,Wikipedia,Mutuo,"Il mutuo è un contratto mediante il quale una parte, detta mutuante, consegna all'altra, detta mutuataria, una somma di denaro o una quantità di beni fungibili in credito o prestito che, l'altra parte, si obbliga a restituire alla scadenza con altrettante cose della stessa specie, qualità o valore. Un mutuo tipico è il mutuo bancario richiesto per la compravendita di beni immobili, ristrutturazioni di edifici o quello richiesto da un imprenditore per le sue attività aziendali (es. investimenti in ricerca e sviluppo, ampliamento ecc...)."
33,Contributi ai giovani per gli affitti,contributi-ai-giovani-per-gli-affitti,https://it.wikipedia.org/wiki/Locazione,Wikipedia,Locazione,"La locazione, in diritto, costituisce il contratto con il quale una parte (detta locatore) si obbliga a permettere a un altro soggetto (conduttore o locatario) l'utilizzo di una cosa per un dato tempo in cambio di un determinato corrispettivo (la cosiddetta ""pigione"" o ""canone"")."
34,"Abolizione della ""Buona Scuola""",abolizione-della-buona-scuola,https://it.wikipedia.org/wiki/Storia_dell%27istruzione_in_Italia#Riforma_%22Buona_Scuola%22,Wikipedia,Storia dell'istruzione in Italia,"La legge 13 luglio 2015, n. 107 di iniziativa del governo Renzi, ha introdotto una nuova riforma della scuola della cd. ""Buona Scuola"" in Italia, aumentando i poteri del dirigente scolastico, introducendo un sistema di valutazione del personale docente, la possibilità per gli studenti di personalizzare parzialmente il piano di studi, se previsto dalla scuola che frequentano, e l'obbligo della alternanza delle attività di scuola e lavoro anche per gli istituti non tecnici."
35,"Abolizione della ""legge Gelmini""",abolizione-della-legge-gelmini,https://it.wikipedia.org/wiki/Riforma_Gelmini,Wikipedia,Riforma Gelmini,"Come riforma Gelmini si indica comunemente l'insieme degli atti normativi della Repubblica Italiana – emanati durante il governo Berlusconi IV – durante la permanenza in carica del Ministro dell'istruzione, dell'università e della ricerca Mariastella Gelmini, riguardanti il settore dell'istruzione in Italia."
36,"Attuazione della ""riforma Cartabia""",attuazione-della-riforma-cartabia,https://pagellapolitica.it/articoli/riforma-csm-approvata,Pagella Politica,"La riforma del Csm, riassunta in quattro punti","La riforma dell’ordinamento giudiziario e del Consiglio superiore della magistratura (CSM) è nota anche come ""riforma Cartabia”, dal nome della ministra della Giustizia Marta Cartabia.  I quattro punti principali della riforma riguradano: l’elezione del CSM; la “separazione delle carriere” dei magistrati; le cosiddette “porte girevoli” nella magistratura (ossia l’ingresso dei magistrati in politica e il loro successivo ritorno al loro lavoro originario); la valutazione dei magistrati."
37,"Abrogazione della ""legge Fornero""",abrogazione-della-legge-fornero,https://it.wikipedia.org/wiki/Riforma_delle_pensioni_Fornero,Wikipedia,Riforma delle pensioni Fornero,"La riforma delle pensioni Fornero è il nome con cui viene comunemente indicato l'articolo 24 del decreto 
legge 6 dicembre 2011, n. 201. Consistette nell'attuazione di un default dei sistemi pensionistici pubblici per ridurre la spesa pubblica legata alle prestazioni pensionistiche in un momento di crisi finanziaria. È quindi una riforma previdenziale del sistema pensionistico pubblico e delle assicurazioni sociali obbligatorie."
38,Alloggi popolari,alloggi-popolari,https://it.wikipedia.org/wiki/Istituto_Autonomo_Case_Popolari,Wikipedia,Istituto Autonomo Case Popolari,"L'Istituto Autonomo Case Popolari (in sigla IACP) è un ente italiano, avente lo scopo di promuovere, realizzare e gestire edilizia pubblica finalizzata all'assegnazione di abitazioni ai meno abbienti, segnatamente in locazione a canoni calmierati."
39,Lotta alla mafia,lotta-alla-mafia,https://it.wikipedia.org/wiki/Mafia_in_Italia,Wikipedia,Mafia in Italia,"La mafia in Italia ha origini e tradizioni secolari e ha avuto un ruolo importante nella storia: prima, durante e dopo l'unità d'Italia."
40,Lotta alla omotransfobia,lotta-alla-omotransfobia,https://www.treccani.it/vocabolario/omotransfobia_%28Neologismi%29/,Treccani,Omotransfobia,"Avversione ossessiva per omosessuali e omosessualità, transessuali e transessualità."
41,Legge sul fine vita,legge-sul-fine-vita,https://it.wikipedia.org/wiki/Suicidio_assistito,Wikipedia,Suicidio assistito,Il suicidio assistito è l'aiuto medico e amministrativo portato a un soggetto che ha deciso di morire tramite suicidio.
42,Parità salariale,parit-salariale,https://it.wikipedia.org/wiki/Divario_retributivo_di_genere,Wikipedia,Divario retributivo di genere,Il divario retributivo di genere è la differenza tra il salario annuale medio percepito dalle donne e quello percepito dagli uomini.
43,Ius scholae,ius-scholae,https://pagellapolitica.it/articoli/fact-checking-ius-scholae,Pagella Politica,Che cos'è lo ius scholae,"In base alla proposta di legge, la cittadinanza italiana può essere concessa a un minore straniero che rispetta una serie di requisiti. Il minore deve essere nato in Italia o deve avervi fatto ingresso entro i 12 anni di età, e deve aver frequentato regolarmente almeno cinque anni di scuola nel territorio nazionale"
44,Ius soli,ius-soli,https://it.wikipedia.org/wiki/Ius_soli,Wikipedia,Ius soli,"Ius soli è un'espressione giuridica che indica l'acquisizione della cittadinanza di un dato Paese come conseguenza del fatto giuridico di essere nati sul suo territorio, indipendentemente dalla cittadinanza dei genitori.Si contrappone allo ius sanguinis (o «diritto del sangue»), che indica invece la trasmissione alla prole della cittadinanza del genitore, sulla base pertanto della discendenza."
45,Voto per i fuorisede,voto-per-i-fuorisede,https://www.iovotofuorisede.it/approfondimento/#Ildirittodivotonegato,iovotofuorisede,Il diritto di voto negato,"L'Italia è l'unico paese europeo che non prevede una legge per il voto a distanza dei cosiddetti cittadini in mobilità, coloro che si trovano a vivere o lavorare lontano dal luogo di residenza. Questa condizione riguarda 5 milioni di persone in Italia che oggi si trasformano in astensionisti involontari, una cifra che raggiunge il 10% del corpo elettorale italiano."
46,Diritto all'aborto,diritto-allaborto,https://it.wikipedia.org/wiki/Aborto,Wikipedia,Aborto,"L'aborto è l'interruzione della gravidanza prima della ventesima o ventiduesima settimana (cioè nel periodo in cui il feto non è capace di vita extrauterina), con conseguente espulsione del feto o dell'embrione dall'utero. Può avvenire spontaneamente o essere procurato."
47,Supporto alla maternità,supporto-alla-maternit,,,,
48,Aumento degli asili nido,aumento-degli-asili-nido,https://it.wikipedia.org/wiki/Asilo_nido,Wikipedia,Asilo nido,"Con asilo nido oppure asilo (in Italia anche nido d'infanzia) si intende la struttura educativa destinata ai bambini di età compresa fra tre mesi e tre anni, che precede l'ingresso alla scuola dell'infanzia (chiamata anche scuola materna)."
49,Congedo di paternità,congedo-di-paternit,https://it.wikipedia.org/wiki/Congedo_parentale,Wikipedia,Congedo parentale,"Il congedo parentale è un periodo di astensione dal lavoro di un genitore. La legge disciplina i tempi e le modalità di astensione, che per alcuni periodi può essere retribuita. La sua funzione è quella di consentire la presenza del genitore accanto al bambino al fine di soddisfare i bisogni affettivi e relazionali del minore."
50,Matrimonio egualitario,matrimonio-egualitario,https://it.wikipedia.org/wiki/Matrimonio_tra_persone_dello_stesso_sesso,Wikipedia,Matrimonio tra persone dello stesso sesso,"In vari Paesi il matrimonio è aperto alle coppie formate da persone dello stesso sesso. All'eventuale identicità di sesso di chi contrae matrimonio ci si riferisce comunemente parlando di matrimonio tra persone dello stesso sesso, matrimonio omosessuale o matrimonio gay."
51,Legalizzazione della cannabis,legalizzazione-della-cannabis,https://it.wikipedia.org/wiki/Legalit%C3%A0_della_cannabis,Wikipedia,Legalità della cannabis,"La legalità della cannabis varia da paese a paese: in Italia è illegale lo spaccio (anche a titolo gratuito), ma non il possesso per l'uso personale, che costituisce solo un illecito amministrativo punibile con sospensione della patente di guida da 1-3 mesi, sospensione del passaporto e della carta d'identità ai fini di espatrio per la medesima durata, senza sporcare la fedina penale. È invece permessa la vendita di Cannabis light, con soglia massima di principio stupefacente (THC) fissata tra lo 0,2% e lo 0,5%."
52,Educazione sessuale,educazione-sessuale,https://it.wikipedia.org/wiki/Educazione_sessuale,Wikipedia,Educazione sessuale,"L'educazione sessuale è una tematica che in molti Paesi genera controversie soprattutto riguardo a: se sia bene includere argomenti come la sessualità infantile, l'uso di anticoncezionali come il profilattico e la ""pillola"" e i loro possibili benefici nel limitare il numero di figli nati fuori del matrimonio, le ragazze madri e le malattie trasmesse sessualmente, come l'AIDS."
53,Ponte sullo Stretto,ponte-sullo-stretto,https://it.wikipedia.org/wiki/Ponte_sullo_stretto_di_Messina,Wikipedia,Ponte sullo stretto di Messina,"Il ponte sullo stretto di Messina è un'opera futuribile di cui si parla da tempo, oggetto di accesi dibattiti relativi a costi, utilità e fattibilità tecnica. Si tratta della realizzazione di un attraversamento stradale e ferroviario stabile dello stretto di Messina, nel quale è attualmente necessario il traghettamento dei mezzi, che collegherà la Sicilia con la Calabria e l'Italia con il continente europeo."
54,Realizzazione delle grandi opere,realizzazione-delle-grandi-opere,,,,
55,Lavoro agile,lavoro-agile,https://it.wikipedia.org/wiki/Lavoro_agile,Wikipedia,Lavoro agile,"Il lavoro agile, anche detto lavoro da remoto, lavoro da casa o più generalmente lavoro a distanza, è una forma di telelavoro definito nell'ordinamento italiano come: «una modalità di esecuzione del rapporto di lavoro subordinato stabilita mediante accordo tra le parti, anche con forme di organizzazione per fasi, cicli e obiettivi e senza precisi vincoli di orario o di luogo di lavoro, con il possibile utilizzo di strumenti tecnologici per lo svolgimento dell'attività lavorativa»."
56,Made in Italy,made-in-italy,https://it.wikipedia.org/wiki/Made_in_Italy,Wikipedia,Made in Italy,"Made in Italy è un'indicazione di provenienza che indica l'origine di un bene in base alle disposizioni comunitarie in materia di origine non preferenziale di un prodotto e, in questo caso, riferite ai prodotti che hanno origine in Italia."
57,Più risorse ai piccoli comuni,pi-risorse-ai-piccoli-comuni,,,,
58,Difesa comune europea,difesa-comune-europea,https://it.wikipedia.org/wiki/Politica_di_sicurezza_e_di_difesa_comune,Wikipedia,Politica di sicurezza e di difesa comune,"La Politica di sicurezza e di difesa comune (acronimo PSDC) è una delle parti più importanti della Politica estera e di sicurezza comune (PESC). Con il Trattato di Lisbona la PESD ha cambiato nome in PSDC ovvero Politica di Sicurezza e Difesa Comune (all' Art.42 TUE), in particolare lo stesso articolo al punto 7 contiene una clausola di mutua difesa che obbliga tutti gli stati UE ad intervenire in solido in caso di necessità."
59,Aumento del numero di medici,aumento-del-numero-di-medici,https://it.wikipedia.org/wiki/Medico_di_famiglia,Wikipedia,Medico di famiglia,
60,Aumento dello stipendio dei docenti,aumento-dello-stipendio-dei-docenti,https://it.wikipedia.org/wiki/Docente,Wikipedia,Docente,
61,Contributi per l'edilizia scolastica,contributi-per-ledilizia-scolastica,https://it.wikipedia.org/wiki/Edilizia_scolastica,Wikipedia,Edilizia scolastica,"Si definisce edilizia scolastica l'attività di costruzione di edifici destinati esclusivamente all'uso scolastico. Gli edifici sono definiti per ordine di studio e per età degli alunni. Dopo la cosiddetta riforma Gelmini si distingue quindi un'edilizia scolastica per l'infanzia, per la scuola primaria e per la scuola superiore di primo e di secondo grado."
62,Apprendistato retribuito,apprendistato-retribuito,https://it.wikipedia.org/wiki/Apprendistato,Wikipedia,Apprendistato,"Per apprendistato si intende generalmente un percorso di apprendimento relativo ad un settore economico-professionale, finalizzato all'acquisizione di qualificazioni o di crediti professionali, durante il quale l'apprendista svolge le attività in contesto lavorativo, prevalentemente con lo status di lavoratore, sulla base di un contratto e seguito da una figura tutoriale."
63,Green pass,green-pass,https://it.wikipedia.org/wiki/Certificato_COVID_digitale_dell%27UE,Wikipedia,Certificato COVID digitale dell'UE,"Il Certificato COVID digitale dell'UE, comunemente noto in Italia anche come Green Pass, è un certificato interoperabile all'interno dell'Unione europea, contenente le informazioni che attestano che il titolare è stato vaccinato contro la COVID-19, o ha da poco effettuato un test diagnostico per SARS-CoV-2 con risultato negativo, oppure è guarito dalla COVID-19."
64,Obbligo vaccinale,obbligo-vaccinale,https://it.wikipedia.org/wiki/Vaccinazioni_obbligatorie,Wikipedia,Vaccinazioni obbligatorie,In Europa è diffusa la pratica di rendere obbligatorie alcune vaccinazioni.
