id,subject,slug,url,source,title,description
132,Contrasto al lavoro nero,contrasto-al-lavoro-nero,https://it.wikipedia.org/wiki/Lavoro_nero,Wikipedia,Lavoro nero,"Con lavoro nero, lavoro irregolare o lavoro in nero si intende un rapporto di lavoro nel quale un datore di lavoro, sia esso una persona fisica o giuridica, si avvale di prestazioni professionali di un lavoratore senza riconoscere a questi alcuna copertura previdenziale, di garanzia, e di tutela previste dalla legge, e senza pagare le imposte previste dalla legge, in virtù di un'assenza di un contratto di lavoro ufficiale."
133,Contrasto alla violenza sulle donne,contrasto-alla-violenza-sulle-donne,https://it.wikipedia.org/wiki/Violenza_contro_le_donne,Wikipedia,Violenza contro le donne,"La violenza contro le donne è la violenza perpetrata contro le donne basata sul genere, ed è ritenuta una violazione dei diritti umani."
134,Transizione digitale,transizione-digitale,https://it.wikipedia.org/wiki/Digital_transformation,Wikipedia,Digital transformation,"La locuzione digital transformation (in italiano trasformazione digitale) indica un insieme di cambiamenti prevalentemente tecnologici, culturali, organizzativi, sociali, creativi e manageriali, associati con le applicazioni di tecnologia digitale, in tutti gli aspetti della società umana."
135,Incentivare il trasporto pubblico,incentivare-il-trasporto-pubblico,https://it.wikipedia.org/wiki/Trasporto_pubblico,Wikipedia,Trasporto pubblico,Con trasporto pubblico si intende il trasporto di persone con l'utilizzo dei vari mezzi di trasporto preposti. Esso non va confuso con il trasporto di turisti o passeggeri operato dalle compagnie aeree o dai pullman.
136,Connessione ad alta velocità,connessione-ad-alta-velocit,,,,
137,Protezione dei dati,protezione-dei-dati,,,,
138,Videosorveglianza di massa,videosorveglianza-di-massa,,,,
139,Gestione nazionale del Servizio Sanitario,gestione-nazionale-del-servizio-sanitario,https://it.wikipedia.org/wiki/Servizio_sanitario_nazionale_(Italia)#Struttura,Wikipedia,Servizio Sanitario Nazionale,"Il Servizio sanitario nazionale non è un'unica amministrazione, ma un insieme di enti ed organi che concorrono al raggiungimento degli obiettivi di tutela della salute dei cittadini."
140,"Abolizione del ""Jobs Act""",abolizione-del-jobs-act,https://it.wikipedia.org/wiki/Jobs_Act,Wikipedia,Jobs Act,"Jobs Act indica informalmente una riforma del diritto del lavoro in Italia (promossa e attuata in Italia dal governo Renzi, attraverso l'emanazione di diversi provvedimenti legislativi e completata nel 2016) volta a flessibilizzare il mercato del lavoro."
141,Riforma del funzionamento dell'UE,riforma-del-funzionamento-dellue,https://it.wikipedia.org/wiki/Maggioranza_qualificata_nell%27Unione_europea,Wikipedia,Maggioranza qualificata nell'Unione europea,"Nel Consiglio dell'Unione europea, per la maggior parte degli atti legislativi da adottare, e nel Consiglio europeo si utilizza il voto a maggioranza qualificata. Per decisioni importanti, quali l'adesione di nuovi paesi o questioni riguardanti la politica estera e di sicurezza, viene adottata la votazione all'unanimità."
142,Adozione per coppie dello stesso sesso,adozione-per-coppie-dello-stesso-sesso,https://it.wikipedia.org/wiki/Adozione_da_parte_di_coppie_dello_stesso_sesso,Wikipedia,Adozione da parte di coppie dello stesso sesso,
143,Adozione per persone single,adozione-per-persone-single,https://it.wikipedia.org/wiki/Adozione,Wikipedia,Adozione,"L'adozione è un istituto giuridico che permette a un soggetto detto adottante di trattare ufficialmente un altro soggetto detto adottato come figlio, il quale assume il cognome dell'adottante."
144,Coltivazione della cannabis per uso personale,coltivazione-della-cannabis-per-uso-personale,https://it.wikipedia.org/wiki/Legalit%C3%A0_della_cannabis,Wikipedia,Legalità della cannabis,"La legalità della cannabis varia da paese a paese: in Italia è illegale lo spaccio (anche a titolo gratuito), ma non il possesso per l'uso personale, che costituisce solo un illecito amministrativo punibile con sospensione della patente di guida da 1-3 mesi, sospensione del passaporto e della carta d'identità ai fini di espatrio per la medesima durata, senza sporcare la fedina penale. È invece permessa la vendita di Cannabis light, con soglia massima di principio stupefacente (THC) fissata tra lo 0,2% e lo 0,5%."
145,Procreazione assisitita per coppie dello stesso sesso o single,procreazione-assisitita-per-coppie-dello-stesso-sesso-o-single,https://it.wikipedia.org/wiki/Procreazione_assistita,Wikipedia,Procreazione assistita,"Con le espressioni procreazione assistita, procreazione artificiale, procreazione medicalmente assistita (PMA) o assistenza medica alla procreazione (AMP) ci si riferisce a tutte le metodiche che permettono di aiutare gli individui a procreare, siano esse chirurgiche, ormonali, farmacologiche o di altro tipo."
146,Eliminazione delle barriere architettoniche,eliminazione-delle-barriere-architettoniche,https://it.wikipedia.org/wiki/Barriera_architettonica,Wikipedia,Barriera architettonica,"Viene definita barriera architettonica qualunque elemento costruttivo che impedisca limiti o faciliti gli spostamenti o la fruizione di servizi, specialmente per le persone con limitata capacità motoria. Da questo consegue che un elemento che non costituisca barriera architettonica per un individuo può invece essere di ostacolo per un altro; si capisce quindi che il concetto di barriera viene percepito in maniera diversa da ogni individuo."
147,Istituzione dello psicologo di base,istituzione-dello-psicologo-di-base,,,,
148,Obbligo di discussione per le proposte di legge di iniziativa popolare,obbligo-di-discussione-per-le-proposte-di-legge-di-iniziativa-popolare,https://it.wikipedia.org/wiki/Legge_di_iniziativa_popolare,Wikipedia,Legge di iniziativa popolare,"La legge di iniziativa popolare è un istituto legislativo relativo all'iniziativa legislativa, mediante il quale i cittadini possono presentare o al Parlamento o a un ente amministrativo locale (come la Regione) un progetto di legge che sarà discusso e votato. Nel sistema politico italiano l'iniziativa popolare non è un istituto di democrazia partecipativa, in quanto la sola volontà del corpo elettorale non produce di per sé effetti sull'ordinamento, infatti vi deve essere anche la volontà del titolare della funzione legislativa (il Parlamento a livello nazionale e il Consiglio Regionale a livello regionale) affinché il testo diventi legge."
149,Potenziamento della firma digitale,potenziamento-della-firma-digitale,https://it.wikipedia.org/wiki/Firma_digitale,Wikipedia,Firma digitale,La firma digitale ex art. 24 Codice dell'amministrazione digitale è un metodo matematico teso a dimostrare l'autenticità di un documento digitale autenticando l'autore di un documento.
150,Ricorso al Golden Power,ricorso-al-golden-power,https://it.wikipedia.org/wiki/Golden_power,Wikipedia,Golden Power,"Il Golden Power è uno strumento normativo, previsto in alcuni ordinamenti giuridici, che permette al Governo di un Paese sovrano di bloccare o apporre particolari condizioni a specifiche operazioni finanziarie, che ricadano nell'interesse nazionale (settori strategici)."
